{
  "version_contrato": 1,
  "video_id": 1,
  "duracion_s": 157.8,
  "idioma": {
    "codigo": "es",
    "confianza": 0.98,
    "fijado_a_mano": false
  },
  "transcripcion": [
    {
      "id": 1,
      "t_inicio": 0.4,
      "t_fin": 5.76,
      "texto": "Buenos días, soy Laura, técnica de mantenimiento de la línea de enjuague.",
      "palabras": [
        {"w": "Buenos", "t": 0.4, "t_fin": 0.85},
        {"w": "días,", "t": 0.91, "t_fin": 1.25},
        {"w": "soy", "t": 1.31, "t_fin": 1.6},
        {"w": "Laura,", "t": 1.66, "t_fin": 2.06},
        {"w": "técnica", "t": 2.12, "t_fin": 2.63},
        {"w": "de", "t": 2.69, "t_fin": 2.92},
        {"w": "mantenimiento", "t": 2.98, "t_fin": 3.81},
        {"w": "de", "t": 3.87, "t_fin": 4.1},
        {"w": "la", "t": 4.16, "t_fin": 4.39},
        {"w": "línea", "t": 4.45, "t_fin": 4.85},
        {"w": "de", "t": 4.91, "t_fin": 5.14},
        {"w": "enjuague.", "t": 5.2, "t_fin": 5.76}
      ]
    },
    {
      "id": 2,
      "t_inicio": 6.36,
      "t_fin": 12.03,
      "texto": "En este video les muestro cómo se cambia el cartucho del filtro de agua.",
      "palabras": [
        {"w": "En", "t": 6.36, "t_fin": 6.59},
        {"w": "este", "t": 6.65, "t_fin": 6.99},
        {"w": "video", "t": 7.05, "t_fin": 7.45},
        {"w": "les", "t": 7.51, "t_fin": 7.8},
        {"w": "muestro", "t": 7.86, "t_fin": 8.37},
        {"w": "cómo", "t": 8.43, "t_fin": 8.77},
        {"w": "se", "t": 8.83, "t_fin": 9.06},
        {"w": "cambia", "t": 9.12, "t_fin": 9.57},
        {"w": "el", "t": 9.63, "t_fin": 9.86},
        {"w": "cartucho", "t": 9.92, "t_fin": 10.48},
        {"w": "del", "t": 10.54, "t_fin": 10.83},
        {"w": "filtro", "t": 10.89, "t_fin": 11.34},
        {"w": "de", "t": 11.4, "t_fin": 11.63},
        {"w": "agua.", "t": 11.69, "t_fin": 12.03}
      ]
    },
    {
      "id": 3,
      "t_inicio": 12.53,
      "t_fin": 19.05,
      "texto": "El cartucho se cambia cada tres meses o cuando el manómetro marca menos de dos bar.",
      "palabras": [
        {"w": "El", "t": 12.53, "t_fin": 12.76},
        {"w": "cartucho", "t": 12.82, "t_fin": 13.38},
        {"w": "se", "t": 13.44, "t_fin": 13.67},
        {"w": "cambia", "t": 13.73, "t_fin": 14.18},
        {"w": "cada", "t": 14.24, "t_fin": 14.58},
        {"w": "tres", "t": 14.64, "t_fin": 14.98},
        {"w": "meses", "t": 15.04, "t_fin": 15.44},
        {"w": "o", "t": 15.5, "t_fin": 15.67},
        {"w": "cuando", "t": 15.73, "t_fin": 16.18},
        {"w": "el", "t": 16.24, "t_fin": 16.47},
        {"w": "manómetro", "t": 16.53, "t_fin": 17.14},
        {"w": "marca", "t": 17.2, "t_fin": 17.6},
        {"w": "menos", "t": 17.66, "t_fin": 18.06},
        {"w": "de", "t": 18.12, "t_fin": 18.35},
        {"w": "dos", "t": 18.41, "t_fin": 18.7},
        {"w": "bar.", "t": 18.76, "t_fin": 19.05}
      ]
    },
    {
      "id": 4,
      "t_inicio": 20.45,
      "t_fin": 25.54,
      "texto": "Primero me pongo los guantes de nitrilo y los lentes de seguridad.",
      "palabras": [
        {"w": "Primero", "t": 20.45, "t_fin": 20.96},
        {"w": "me", "t": 21.02, "t_fin": 21.25},
        {"w": "pongo", "t": 21.31, "t_fin": 21.71},
        {"w": "los", "t": 21.77, "t_fin": 22.06},
        {"w": "guantes", "t": 22.12, "t_fin": 22.63},
        {"w": "de", "t": 22.69, "t_fin": 22.92},
        {"w": "nitrilo", "t": 22.98, "t_fin": 23.49},
        {"w": "y", "t": 23.55, "t_fin": 23.72},
        {"w": "los", "t": 23.78, "t_fin": 24.07},
        {"w": "lentes", "t": 24.13, "t_fin": 24.58},
        {"w": "de", "t": 24.64, "t_fin": 24.87},
        {"w": "seguridad.", "t": 24.93, "t_fin": 25.54}
      ]
    },
    {
      "id": 5,
      "t_inicio": 25.94,
      "t_fin": 31.64,
      "texto": "Los lentes son obligatorios porque al liberar la presión puede salpicar agua.",
      "palabras": [
        {"w": "Los", "t": 25.94, "t_fin": 26.23},
        {"w": "lentes", "t": 26.29, "t_fin": 26.74},
        {"w": "son", "t": 26.8, "t_fin": 27.09},
        {"w": "obligatorios", "t": 27.15, "t_fin": 27.93},
        {"w": "porque", "t": 27.99, "t_fin": 28.44},
        {"w": "al", "t": 28.5, "t_fin": 28.73},
        {"w": "liberar", "t": 28.79, "t_fin": 29.3},
        {"w": "la", "t": 29.36, "t_fin": 29.59},
        {"w": "presión", "t": 29.65, "t_fin": 30.16},
        {"w": "puede", "t": 30.22, "t_fin": 30.62},
        {"w": "salpicar", "t": 30.68, "t_fin": 31.24},
        {"w": "agua.", "t": 31.3, "t_fin": 31.64}
      ]
    },
    {
      "id": 6,
      "t_inicio": 33.44,
      "t_fin": 40.77,
      "texto": "Ahora cierro la llave de paso que está antes del filtro, girándola a la derecha hasta el tope.",
      "palabras": [
        {"w": "Ahora", "t": 33.44, "t_fin": 33.84},
        {"w": "cierro", "t": 33.9, "t_fin": 34.35},
        {"w": "la", "t": 34.41, "t_fin": 34.64},
        {"w": "llave", "t": 34.7, "t_fin": 35.1},
        {"w": "de", "t": 35.16, "t_fin": 35.39},
        {"w": "paso", "t": 35.45, "t_fin": 35.79},
        {"w": "que", "t": 35.85, "t_fin": 36.14},
        {"w": "está", "t": 36.2, "t_fin": 36.54},
        {"w": "antes", "t": 36.6, "t_fin": 37.0},
        {"w": "del", "t": 37.06, "t_fin": 37.35},
        {"w": "filtro,", "t": 37.41, "t_fin": 37.86},
        {"w": "girándola", "t": 37.92, "t_fin": 38.53},
        {"w": "a", "t": 38.59, "t_fin": 38.76},
        {"w": "la", "t": 38.82, "t_fin": 39.05},
        {"w": "derecha", "t": 39.11, "t_fin": 39.62},
        {"w": "hasta", "t": 39.68, "t_fin": 40.08},
        {"w": "el", "t": 40.14, "t_fin": 40.37},
        {"w": "tope.", "t": 40.43, "t_fin": 40.77}
      ]
    },
    {
      "id": 7,
      "t_inicio": 41.27,
      "t_fin": 46.98,
      "texto": "La manija debe quedar atravesada a la tubería; así sabemos que está cerrada.",
      "palabras": [
        {"w": "La", "t": 41.27, "t_fin": 41.5},
        {"w": "manija", "t": 41.56, "t_fin": 42.01},
        {"w": "debe", "t": 42.07, "t_fin": 42.41},
        {"w": "quedar", "t": 42.47, "t_fin": 42.92},
        {"w": "atravesada", "t": 42.98, "t_fin": 43.65},
        {"w": "a", "t": 43.71, "t_fin": 43.88},
        {"w": "la", "t": 43.94, "t_fin": 44.17},
        {"w": "tubería;", "t": 44.23, "t_fin": 44.74},
        {"w": "así", "t": 44.8, "t_fin": 45.09},
        {"w": "sabemos", "t": 45.15, "t_fin": 45.66},
        {"w": "que", "t": 45.72, "t_fin": 46.01},
        {"w": "está", "t": 46.07, "t_fin": 46.41},
        {"w": "cerrada.", "t": 46.47, "t_fin": 46.98}
      ]
    },
    {
      "id": 8,
      "t_inicio": 47.68,
      "t_fin": 53.91,
      "texto": "Si la llave está muy dura no usen extensión, mejor avisen al supervisor de turno.",
      "palabras": [
        {"w": "Si", "t": 47.68, "t_fin": 47.91},
        {"w": "la", "t": 47.97, "t_fin": 48.2},
        {"w": "llave", "t": 48.26, "t_fin": 48.66},
        {"w": "está", "t": 48.72, "t_fin": 49.06},
        {"w": "muy", "t": 49.12, "t_fin": 49.41},
        {"w": "dura", "t": 49.47, "t_fin": 49.81},
        {"w": "no", "t": 49.87, "t_fin": 50.1},
        {"w": "usen", "t": 50.16, "t_fin": 50.5},
        {"w": "extensión,", "t": 50.56, "t_fin": 51.17},
        {"w": "mejor", "t": 51.23, "t_fin": 51.63},
        {"w": "avisen", "t": 51.69, "t_fin": 52.14},
        {"w": "al", "t": 52.2, "t_fin": 52.43},
        {"w": "supervisor", "t": 52.49, "t_fin": 53.16},
        {"w": "de", "t": 53.22, "t_fin": 53.45},
        {"w": "turno.", "t": 53.51, "t_fin": 53.91}
      ]
    },
    {
      "id": 9,
      "t_inicio": 55.51,
      "t_fin": 61.3,
      "texto": "Después libero la presión con el botón rojo que está arriba de la carcasa.",
      "palabras": [
        {"w": "Después", "t": 55.51, "t_fin": 56.02},
        {"w": "libero", "t": 56.08, "t_fin": 56.53},
        {"w": "la", "t": 56.59, "t_fin": 56.82},
        {"w": "presión", "t": 56.88, "t_fin": 57.39},
        {"w": "con", "t": 57.45, "t_fin": 57.74},
        {"w": "el", "t": 57.8, "t_fin": 58.03},
        {"w": "botón", "t": 58.09, "t_fin": 58.49},
        {"w": "rojo", "t": 58.55, "t_fin": 58.89},
        {"w": "que", "t": 58.95, "t_fin": 59.24},
        {"w": "está", "t": 59.3, "t_fin": 59.64},
        {"w": "arriba", "t": 59.7, "t_fin": 60.15},
        {"w": "de", "t": 60.21, "t_fin": 60.44},
        {"w": "la", "t": 60.5, "t_fin": 60.73},
        {"w": "carcasa.", "t": 60.79, "t_fin": 61.3}
      ]
    },
    {
      "id": 10,
      "t_inicio": 61.7,
      "t_fin": 67.86,
      "texto": "Lo mantengo presionado hasta que deja de salir aire y el manómetro baja a cero.",
      "palabras": [
        {"w": "Lo", "t": 61.7, "t_fin": 61.93},
        {"w": "mantengo", "t": 61.99, "t_fin": 62.55},
        {"w": "presionado", "t": 62.61, "t_fin": 63.28},
        {"w": "hasta", "t": 63.34, "t_fin": 63.74},
        {"w": "que", "t": 63.8, "t_fin": 64.09},
        {"w": "deja", "t": 64.15, "t_fin": 64.49},
        {"w": "de", "t": 64.55, "t_fin": 64.78},
        {"w": "salir", "t": 64.84, "t_fin": 65.24},
        {"w": "aire", "t": 65.3, "t_fin": 65.64},
        {"w": "y", "t": 65.7, "t_fin": 65.87},
        {"w": "el", "t": 65.93, "t_fin": 66.16},
        {"w": "manómetro", "t": 66.22, "t_fin": 66.83},
        {"w": "baja", "t": 66.89, "t_fin": 67.23},
        {"w": "a", "t": 67.29, "t_fin": 67.46},
        {"w": "cero.", "t": 67.52, "t_fin": 67.86}
      ]
    },
    {
      "id": 11,
      "t_inicio": 68.76,
      "t_fin": 73.56,
      "texto": "Pongo una cubeta debajo porque siempre escurre un poco de agua.",
      "palabras": [
        {"w": "Pongo", "t": 68.76, "t_fin": 69.16},
        {"w": "una", "t": 69.22, "t_fin": 69.51},
        {"w": "cubeta", "t": 69.57, "t_fin": 70.02},
        {"w": "debajo", "t": 70.08, "t_fin": 70.53},
        {"w": "porque", "t": 70.59, "t_fin": 71.04},
        {"w": "siempre", "t": 71.1, "t_fin": 71.61},
        {"w": "escurre", "t": 71.67, "t_fin": 72.18},
        {"w": "un", "t": 72.24, "t_fin": 72.47},
        {"w": "poco", "t": 72.53, "t_fin": 72.87},